{
  "$schema": "https://json-schema.org/draft/2020-12/schema",
  "$id": "https://hivemind.local/schemas/v0/question.asked.json",
  "title": "question.asked event",
  "type": "object",
  "additionalProperties": false,
  "required": ["event_uuid", "type", "actor_id", "source", "payload"],
  "properties": {
    "event_id": { "type": ["integer", "null"], "minimum": 1 },
    "event_uuid": { "type": "string", "format": "uuid" },
    "correlation_id": { "type": ["string", "null"], "minLength": 1 },
    "causation_event_id": { "type": ["integer", "null"], "minimum": 1 },
    "type": { "const": "question.asked" },
    "actor_id": { "type": "string", "minLength": 1 },
    "source": { "enum": ["cli", "agent", "human", "slack", "document", "api"] },
    "source_ref": { "type": ["string", "null"], "minLength": 1 },
    "ts": { "type": ["string", "null"], "format": "date-time" },
    "payload": {
      "type": "object",
      "additionalProperties": false,
      "required": ["question_id", "text"],
      "properties": {
        "question_id": { "type": "string", "minLength": 1 },
        "text": {
          "type": "string",
          "minLength": 1,
          "description": "The question as asked. Resolved to a Question node by exact match after lowercasing, collapsing whitespace and dropping trailing punctuation, exactly as `question.recorded` does; an ask can name a question that already has answers, or one nobody has answered yet."
        }
      }
    }
  }
}
